[
  {
    "id": "nl.easeo.lijstje", "name": "Lijstje", "version": "0.1.0",
    "icon": "https://plein.sovereignaigrid.nl/miniapps/lijstje/icon.svg",
    "entry": "https://plein.sovereignaigrid.nl/miniapps/lijstje/",
    "provider": { "name": "EASEO", "url": "https://easeo.nl" },
    "permissions": ["identity", "storage"]
  },
  {
    "id": "nl.nixpay.betalen", "name": "Betaal-demo", "version": "0.1.0",
    "icon": "https://plein.sovereignaigrid.nl/miniapps/betalen/icon.svg",
    "entry": "https://plein.sovereignaigrid.nl/miniapps/betalen/",
    "provider": { "name": "Nixpay", "url": "https://nixpay.eu" },
    "permissions": ["payments", "identity"]
  }
]
